<?xml version="1.0" encoding="utf-8"?>
<Rules xmlns="OrientalEmpires" xmlns:xsi="http://www.w3.org/2001/XMLSchema-instance" xsi:schemaLocation="OrientalEmpires Rules.xsd">

  <!-- MOVEMENT RULES ////////////////////////////////////////////////////////-->
  <!-- Terrain Classes -->
  <!-- Land -->
  <TerrainClass Name="FlatGround" />
  <TerrainClass Name="SoftGround" />
  <TerrainClass Name="RoughGround" />
  <TerrainClass Name="GentleHills" />
  <TerrainClass Name="SteepHills" />
  <TerrainClass Name="Mountains" />
  <TerrainClass Name="Forest" />
  <TerrainClass Name="Impassable" />

  <!-- Water -->
  <TerrainClass Name="Ocean" Water="true" CapabilityNeededToPass="Oceanfaring" />
  <TerrainClass Name="Sea" Water="true" CapabilityNeededToPass="Seafaring" />
  <TerrainClass Name="Coastal" Water="true" />
  <TerrainClass Name="NavigableRiver" Water="true" />
  <TerrainClass Name="UnnavigableRiver" Water="true" />

  <!-- Movement Classes -->
  <!-- All terrain classes cost 1 move point unless otherwise specified -->
  <!-- Water terrain is impassable to non naval and land is impassable to naval unless otherwise specified -->
  <!-- Land -->
  <MovementClass Name="BaseLandF" MovePoints="4" Naval="false" RoadModifier="0.66">
    <Impassable Class="Impassable" />
    <Impassable Class="Mountains" />
    <Impassable Class="SteepHills" />
    <Impassable Class="Ocean" />
    <Impassable Class="Sea" />
    <Impassable Class="Coastal" />
    <Impassable Class="UnnavigableRiver" />
    <Terrain Class="NavigableRiver" Points="-1" CrossingOnly="true" />
    <Terrain Class="Forest" Points="-1" CrossingOnly="true" />
  </MovementClass>
  <MovementClass Name="BaseLandF1" MovePoints="4" Naval="false" RoadModifier="0.66">
    <Impassable Class="Impassable" />
    <Impassable Class="Mountains" />
    <Impassable Class="SteepHills" />
    <Impassable Class="Ocean" />
    <Impassable Class="Sea" />
    <Impassable Class="Coastal" />
    <Impassable Class="UnnavigableRiver" />
    <Terrain Class="NavigableRiver" Points="-1" CrossingOnly="true" />
    <Terrain Class="Forest" Points="1" CrossingOnly="true" />
  </MovementClass>
  <MovementClass Name="BaseLand" MovePoints="4" Naval="false" RoadModifier="0.66">
    <Impassable Class="Impassable" />
    <Impassable Class="Mountains" />
    <Impassable Class="SteepHills" />
    <Impassable Class="Ocean" />
    <Impassable Class="Sea" />
    <Impassable Class="Coastal" />
    <Terrain Class="NavigableRiver" Points="-1" CrossingOnly="true" />
    <Terrain Class="UnnavigableRiver" Points="-1" CrossingOnly="true" />
    <Terrain Class="Forest" Points="2" />
  </MovementClass>
  <MovementClass Name="NoForest" MovePoints="4" Naval="false" RoadModifier="0.66">
    <Impassable Class="Impassable" />
    <Impassable Class="Mountains" />
    <Impassable Class="SteepHills" />
    <Impassable Class="Ocean" />
    <Impassable Class="Sea" />
    <Impassable Class="Coastal" />
    <Impassable Class="UnnavigableRiver" />
    <Impassable Class="Forest" />
    <Terrain Class="NavigableRiver" Points="-1" CrossingOnly="true" />
  </MovementClass>
  <MovementClass Name="Garrisson" MovePoints="1" Naval="false" RoadModifier="1">
    <Impassable Class="Impassable" />
    <Impassable Class="Mountains" />
    <Impassable Class="SteepHills" />
    <Impassable Class="Ocean" />
    <Impassable Class="Sea" />
    <Impassable Class="Coastal" />
    <Impassable Class="UnnavigableRiver" />
    <Impassable Class="Forest" />
    <Impassable Class="NavigableRiver" />
    <Impassable Class="SoftGround" />
    <Impassable Class="RoughGround" />
  </MovementClass>
  <MovementClass Name="Tier 1 Infantry" Base="BaseLand" MovePoints="13" Naval="false" RoadModifier="0.66">
    <Terrain Class="SoftGround" Points="11" />
    <Terrain Class="RoughGround" Points="9" />
  </MovementClass>
  <MovementClass Name="Tier 2 Infantry" Base="BaseLand" MovePoints="12" Naval="false" RoadModifier="0.66">
    <Terrain Class="SoftGround" Points="10" />
    <Terrain Class="RoughGround" Points="8" />
  </MovementClass>
  <MovementClass Name="Tier 3 Infantry" Base="BaseLandF" MovePoints="11" Naval="false" RoadModifier="0.66">
    <Terrain Class="SoftGround" Points="9" />
    <Terrain Class="RoughGround" Points="7" />
  </MovementClass>
  <MovementClass Name="Tier 4 Infantry" Base="BaseLandF" MovePoints="10" Naval="false" RoadModifier="0.66">
    <Terrain Class="SoftGround" Points="8" />
    <Terrain Class="RoughGround" Points="6" />
  </MovementClass>
  <MovementClass Name="Tier 5 Infantry" Base="BaseLandF" MovePoints="9" Naval="false" RoadModifier="0.66">
    <Terrain Class="SoftGround" Points="7" />
    <Terrain Class="RoughGround" Points="6" />
  </MovementClass>
  <MovementClass Name="Tier 6 Infantry" Base="BaseLandF" MovePoints="8" Naval="false" RoadModifier="0.66">
    <Terrain Class="SoftGround" Points="6" />
    <Terrain Class="RoughGround" Points="5" />
  </MovementClass>
  <MovementClass Name="Tier 7 Infantry" Base="BaseLandF" MovePoints="7" Naval="false" RoadModifier="0.66">
    <Terrain Class="SoftGround" Points="5" />
    <Terrain Class="RoughGround" Points="4" />
  </MovementClass>
  <MovementClass Name="Tier 1 Cavalry" Base="BaseLandF1" MovePoints="15" Naval="false" RoadModifier="0.8">
    <Terrain Class="SoftGround" Points="13" />
    <Terrain Class="RoughGround" Points="11" />
  </MovementClass>
  <MovementClass Name="Tier 2 Cavalry" Base="BaseLandF1" MovePoints="14" Naval="false" RoadModifier="0.8">
    <Terrain Class="SoftGround" Points="12" />
    <Terrain Class="RoughGround" Points="10" />
  </MovementClass>
  <MovementClass Name="Tier 3 Cavalry" Base="BaseLandF" MovePoints="13" Naval="false" RoadModifier="0.8">
    <Terrain Class="SoftGround" Points="11" />
    <Terrain Class="RoughGround" Points="9" />
  </MovementClass>
  <MovementClass Name="Tier 4 Cavalry" Base="NoForest" MovePoints="12" Naval="false" RoadModifier="0.8">
    <Terrain Class="SoftGround" Points="10" />
    <Terrain Class="RoughGround" Points="8" />
  </MovementClass>
  <MovementClass Name="Tier 5 Cavalry" Base="NoForest" MovePoints="11" Naval="false" RoadModifier="0.8">
    <Terrain Class="SoftGround" Points="9" />
    <Terrain Class="RoughGround" Points="7" />
  </MovementClass>
  <MovementClass Name="Tier 6 Cavalry" Base="NoForest" MovePoints="10" Naval="false" RoadModifier="0.8">
    <Terrain Class="SoftGround" Points="8" />
    <Terrain Class="RoughGround" Points="6" />
  </MovementClass>
  <MovementClass Name="Tier 7 Cavalry" Base="NoForest" MovePoints="9" Naval="false" RoadModifier="0.8">
    <Terrain Class="SoftGround" Points="7" />
    <Terrain Class="RoughGround" Points="4" />
  </MovementClass>
  <MovementClass Name="Tier 1 Chariot" Base="NoForest" MovePoints="16" Naval="false" RoadModifier="0.8">
    <Terrain Class="SoftGround" Points="7" />
    <Terrain Class="RoughGround" Points="8" />
  </MovementClass>
  <MovementClass Name="Tier 1 Chariot" Base="NoForest" MovePoints="15" Naval="false" RoadModifier="0.8">
    <Terrain Class="SoftGround" Points="6" />
    <Terrain Class="RoughGround" Points="7" />
  </MovementClass>
  <MovementClass Name="Tier 3 Chariot" Base="NoForest" MovePoints="14" Naval="false" RoadModifier="0.8">
    <Terrain Class="SoftGround" Points="5" />
    <Terrain Class="RoughGround" Points="6" />
  </MovementClass>
  <MovementClass Name="Tier 4 Chariot" Base="NoForest" MovePoints="13" Naval="false" RoadModifier="0.8">
    <Terrain Class="SoftGround" Points="4" />
    <Terrain Class="RoughGround" Points="5" />
  </MovementClass>
  <MovementClass Name="Tier 5 Chariot" Base="NoForest" MovePoints="12" Naval="false" RoadModifier="0.8">
    <Terrain Class="SoftGround" Points="3" />
    <Terrain Class="RoughGround" Points="4" />
  </MovementClass>
  <MovementClass Name="Tier 6 Chariot" Base="NoForest" MovePoints="10" Naval="false" RoadModifier="0.8">
    <Terrain Class="SoftGround" Points="2" />
    <Terrain Class="RoughGround" Points="3" />
  </MovementClass>
  <MovementClass Name="Tier 7 Chariot" Base="NoForest" MovePoints="9" Naval="false" RoadModifier="0.8">
    <Terrain Class="SoftGround" Points="1" />
    <Terrain Class="RoughGround" Points="2" />
  </MovementClass>
  <MovementClass Name="Baggage Train" Base="NoForest" MovePoints="12" Naval="false" RoadModifier="0.66">
    <Terrain Class="SoftGround" Points="10" />
    <Terrain Class="RoughGround" Points="8" />
  </MovementClass>
  <MovementClass Name="Settler" Base="BaseLand" MovePoints="16" Naval="false" RoadModifier="0.66">
    <Terrain Class="SoftGround" Points="14" />
    <Terrain Class="RoughGround" Points="12" />
  </MovementClass>
  <!--Base-->
  <MovementClass Name="Infantry" Base="BaseLand" MovePoints="4" Naval="false" RoadModifier="0.66">
    <Terrain Class="SoftGround" Points="2" />
  </MovementClass>
  <MovementClass Name="Light Infantry" Base="Infantry" MovePoints="5" Naval="false" RoadModifier="0.66">
    <Terrain Class="Forest" Points="1" />
    <Terrain Class="SoftGround" Points="1" />
  </MovementClass>
  <MovementClass Name="Light Cavalry" Base="BaseLand" MovePoints="8" Naval="false" RoadModifier="0.8">
    <Terrain Class="Forest" Points="6" />
    <Terrain Class="SoftGround" Points="6" />
  </MovementClass>
  <MovementClass Name="Scout Cavalry" Base="BaseLand" MovePoints="10" Naval="false" RoadModifier="0.8">
    <Terrain Class="Forest" Points="3" />
    <Terrain Class="SoftGround" Points="5" />
  </MovementClass>
  <MovementClass Name="Heavy Cavalry" Base="BaseLand" MovePoints="6" Naval="false" RoadModifier="0.8">
    <Terrain Class="Forest" Points="4" />
    <Terrain Class="SoftGround" Points="4" />
  </MovementClass>
  <MovementClass Name="Chariot" Base="BaseLand" MovePoints="6" Naval="false" RoadModifier="0.8">
    <Terrain Class="Forest" Points="6" />